{
  "$schema": "../../../../schemas/program-media-presentation.schema.json",
  "record_control": {
    "revision": 1,
    "record_status": "constructed",
    "constructor": {
      "actor_id": "codex-task:network-museum-exhibition-media-2026-08-11",
      "role": "constructor",
      "constructed_at": "2026-08-11T22:44:52.647Z"
    },
    "review": null
  },
  "record_type": "PROGRAM_MEDIA_PRESENTATION",
  "schema_profile": "6529NM_PROGRAM_MEDIA_PRESENTATION_V1",
  "program_id": "6529NM-AP-01",
  "source_manifest_revision": 4,
  "generated_at": "2026-08-11T22:44:52.647Z",
  "transform_profile": "6529NM_WEB_PRESENTATION_WEBP_V2_Q82_M6_FIXED_ICC",
  "delivery": {
    "status": "approved_by_reviewed_display_authority",
    "authority_record_id": "6529NM-AP-01-MEDIA-DISPLAY-2026-08-11-009",
    "cache_control": "public, max-age=31536000, immutable"
  },
  "items": [
    {
      "record_id": "6529NM-AP-01-OUT-001",
      "presentation": {
        "role": "web_presentation_surrogate",
        "alt_text": "A lone figure stands before a tall blue patterned gate as sunlight casts long geometric shadows across a stone hall.",
        "alt_text_status": "constructed_visual_description_reviewed",
        "public_widths": [
          640,
          1280,
          2400
        ],
        "derivatives": [
          {
            "width": 640,
            "height": 960,
            "mime_type": "image/webp",
            "sha256": "sha256:3e20417e312f145184476d3c122992754899a136313359e72294eb8f781d59f0",
            "byte_size": 126768,
            "repository_path": "media/programs/6529NM-AP-01/6529NM-AP-01-OUT-001/898df24ecb82ac0b32ca99e995e5c1b027c47d6b1bef8d636eb2b06640d9ea66/webp-v2-q82-m6-fixed-icc/640.webp",
            "url": "https://d3lqz0a4bldqgf.cloudfront.net/museum/programs/6529NM-AP-01/6529NM-AP-01-OUT-001/898df24ecb82ac0b32ca99e995e5c1b027c47d6b1bef8d636eb2b06640d9ea66/webp-v2-q82-m6-fixed-icc/640.webp",
            "cache_control": "public, max-age=31536000, immutable"
          },
          {
            "width": 1280,
            "height": 1920,
            "mime_type": "image/webp",
            "sha256": "sha256:d28e89b7ca58647ce0b7a0979ca8138d4213c3c0b4080d76b7f154b522612b04",
            "byte_size": 510514,
            "repository_path": "media/programs/6529NM-AP-01/6529NM-AP-01-OUT-001/898df24ecb82ac0b32ca99e995e5c1b027c47d6b1bef8d636eb2b06640d9ea66/webp-v2-q82-m6-fixed-icc/1280.webp",
            "url": "https://d3lqz0a4bldqgf.cloudfront.net/museum/programs/6529NM-AP-01/6529NM-AP-01-OUT-001/898df24ecb82ac0b32ca99e995e5c1b027c47d6b1bef8d636eb2b06640d9ea66/webp-v2-q82-m6-fixed-icc/1280.webp",
            "cache_control": "public, max-age=31536000, immutable"
          },
          {
            "width": 2400,
            "height": 3600,
            "mime_type": "image/webp",
            "sha256": "sha256:a2c571eeec02f38b9408820769766897522e3697ceceed32d167e86706046696",
            "byte_size": 1617734,
            "repository_path": "media/programs/6529NM-AP-01/6529NM-AP-01-OUT-001/898df24ecb82ac0b32ca99e995e5c1b027c47d6b1bef8d636eb2b06640d9ea66/webp-v2-q82-m6-fixed-icc/2400.webp",
            "url": "https://d3lqz0a4bldqgf.cloudfront.net/museum/programs/6529NM-AP-01/6529NM-AP-01-OUT-001/898df24ecb82ac0b32ca99e995e5c1b027c47d6b1bef8d636eb2b06640d9ea66/webp-v2-q82-m6-fixed-icc/2400.webp",
            "cache_control": "public, max-age=31536000, immutable"
          }
        ]
      }
    },
    {
      "record_id": "6529NM-AP-01-OUT-002",
      "presentation": {
        "role": "web_presentation_surrogate",
        "alt_text": "An elevated view shows blurred buses and traffic around a sharply defined person seated in a small blue tub or boat on the roadway.",
        "alt_text_status": "constructed_visual_description_reviewed",
        "public_widths": [
          640,
          1280,
          2400
        ],
        "derivatives": [
          {
            "width": 640,
            "height": 427,
            "mime_type": "image/webp",
            "sha256": "sha256:fc6d063ce1587e44ec90a58c3e4ad86574c88be98fcb32d67a14d361967f3a38",
            "byte_size": 53848,
            "repository_path": "media/programs/6529NM-AP-01/6529NM-AP-01-OUT-002/e3d4f538d4c9d3aa79a1d7ed11e93819a806fad85dbed4b8b38e9c62528d55fe/webp-v2-q82-m6-fixed-icc/640.webp",
            "url": "https://d3lqz0a4bldqgf.cloudfront.net/museum/programs/6529NM-AP-01/6529NM-AP-01-OUT-002/e3d4f538d4c9d3aa79a1d7ed11e93819a806fad85dbed4b8b38e9c62528d55fe/webp-v2-q82-m6-fixed-icc/640.webp",
            "cache_control": "public, max-age=31536000, immutable"
          },
          {
            "width": 1280,
            "height": 853,
            "mime_type": "image/webp",
            "sha256": "sha256:3d67ee66b9000bc4c461bf3e4f2a792b210eef107cdc8dda48e86ad32748425e",
            "byte_size": 196224,
            "repository_path": "media/programs/6529NM-AP-01/6529NM-AP-01-OUT-002/e3d4f538d4c9d3aa79a1d7ed11e93819a806fad85dbed4b8b38e9c62528d55fe/webp-v2-q82-m6-fixed-icc/1280.webp",
            "url": "https://d3lqz0a4bldqgf.cloudfront.net/museum/programs/6529NM-AP-01/6529NM-AP-01-OUT-002/e3d4f538d4c9d3aa79a1d7ed11e93819a806fad85dbed4b8b38e9c62528d55fe/webp-v2-q82-m6-fixed-icc/1280.webp",
            "cache_control": "public, max-age=31536000, immutable"
          },
          {
            "width": 2400,
            "height": 1600,
            "mime_type": "image/webp",
            "sha256": "sha256:27be835c3c03027164944bfc914025f7eada3f6909cede05690bb27746fb5269",
            "byte_size": 659890,
            "repository_path": "media/programs/6529NM-AP-01/6529NM-AP-01-OUT-002/e3d4f538d4c9d3aa79a1d7ed11e93819a806fad85dbed4b8b38e9c62528d55fe/webp-v2-q82-m6-fixed-icc/2400.webp",
            "url": "https://d3lqz0a4bldqgf.cloudfront.net/museum/programs/6529NM-AP-01/6529NM-AP-01-OUT-002/e3d4f538d4c9d3aa79a1d7ed11e93819a806fad85dbed4b8b38e9c62528d55fe/webp-v2-q82-m6-fixed-icc/2400.webp",
            "cache_control": "public, max-age=31536000, immutable"
          }
        ]
      }
    },
    {
      "record_id": "6529NM-AP-01-OUT-003",
      "presentation": {
        "role": "web_presentation_surrogate",
        "alt_text": "A rider on a rearing white horse rises above a herd of brown horses on a wide plain beneath hazy mountains.",
        "alt_text_status": "constructed_visual_description_reviewed",
        "public_widths": [
          640,
          1280,
          2400
        ],
        "derivatives": [
          {
            "width": 640,
            "height": 427,
            "mime_type": "image/webp",
            "sha256": "sha256:c45f68c1907ac9475cea8f15288a96887e502567f61e35ee9ac09aa53ffa6461",
            "byte_size": 21572,
            "repository_path": "media/programs/6529NM-AP-01/6529NM-AP-01-OUT-003/4efc4651598006e212d159710714181c61dc3dfdc80719b7ae8a573f382d9eca/webp-v2-q82-m6-fixed-icc/640.webp",
            "url": "https://d3lqz0a4bldqgf.cloudfront.net/museum/programs/6529NM-AP-01/6529NM-AP-01-OUT-003/4efc4651598006e212d159710714181c61dc3dfdc80719b7ae8a573f382d9eca/webp-v2-q82-m6-fixed-icc/640.webp",
            "cache_control": "public, max-age=31536000, immutable"
          },
          {
            "width": 1280,
            "height": 853,
            "mime_type": "image/webp",
            "sha256": "sha256:58d70f550e2ea17f6e727db7214f49ff52376917fbc6fb5260554cd39cf3749b",
            "byte_size": 57990,
            "repository_path": "media/programs/6529NM-AP-01/6529NM-AP-01-OUT-003/4efc4651598006e212d159710714181c61dc3dfdc80719b7ae8a573f382d9eca/webp-v2-q82-m6-fixed-icc/1280.webp",
            "url": "https://d3lqz0a4bldqgf.cloudfront.net/museum/programs/6529NM-AP-01/6529NM-AP-01-OUT-003/4efc4651598006e212d159710714181c61dc3dfdc80719b7ae8a573f382d9eca/webp-v2-q82-m6-fixed-icc/1280.webp",
            "cache_control": "public, max-age=31536000, immutable"
          },
          {
            "width": 2400,
            "height": 1600,
            "mime_type": "image/webp",
            "sha256": "sha256:2e5f3c80266181f1d7f0cfb0ae235a243828063fd958ea9ff6ef62b5ba7a0db9",
            "byte_size": 154486,
            "repository_path": "media/programs/6529NM-AP-01/6529NM-AP-01-OUT-003/4efc4651598006e212d159710714181c61dc3dfdc80719b7ae8a573f382d9eca/webp-v2-q82-m6-fixed-icc/2400.webp",
            "url": "https://d3lqz0a4bldqgf.cloudfront.net/museum/programs/6529NM-AP-01/6529NM-AP-01-OUT-003/4efc4651598006e212d159710714181c61dc3dfdc80719b7ae8a573f382d9eca/webp-v2-q82-m6-fixed-icc/2400.webp",
            "cache_control": "public, max-age=31536000, immutable"
          }
        ]
      }
    },
    {
      "record_id": "6529NM-AP-01-OUT-004",
      "presentation": {
        "role": "web_presentation_surrogate",
        "alt_text": "Two silhouetted figures walk toward daylight at the end of a rough stone passage.",
        "alt_text_status": "constructed_visual_description_reviewed",
        "public_widths": [
          640
        ],
        "derivatives": [
          {
            "width": 640,
            "height": 640,
            "mime_type": "image/webp",
            "sha256": "sha256:8e0915b020965a6090c868ba29397c03ee8322d84ebca32fe3714f0537d96987",
            "byte_size": 45202,
            "repository_path": "media/programs/6529NM-AP-01/6529NM-AP-01-OUT-004/30e39b61e696cdab4b3a54beec5b33c2152f7440343479a45bc7bfe2175b0782/webp-v2-q82-m6-fixed-icc/640.webp",
            "url": "https://d3lqz0a4bldqgf.cloudfront.net/museum/programs/6529NM-AP-01/6529NM-AP-01-OUT-004/30e39b61e696cdab4b3a54beec5b33c2152f7440343479a45bc7bfe2175b0782/webp-v2-q82-m6-fixed-icc/640.webp",
            "cache_control": "public, max-age=31536000, immutable"
          }
        ]
      }
    },
    {
      "record_id": "6529NM-AP-01-OUT-005",
      "presentation": {
        "role": "web_presentation_surrogate",
        "alt_text": "A long weathered concrete barrier with faded graffiti divides a pale sky from a dark foreground.",